[
  {
    "name": "gdrive-personal",
    "remote": "gdrive_personal:",
    "drive_letter": "E:",
    "volume_name": "GoogleDrive - Personal",
    "cache_dir": ".cache/gdrive_personal",
    "cache_size": "20G",
    "buffer_size": "16M",
    "read_chunk_size": "16M",
    "read_chunk_limit": "256M",
    "read_only": false,
    "icon": "assets/icons/googledrive.ico"
  },
  {
    "name": "gdrive-campus",
    "remote": "gdrive_campus:",
    "drive_letter": "F:",
    "volume_name": "GoogleDrive - Campus",
    "cache_dir": ".cache/gdrive_campus",
    "cache_size": "15G",
    "buffer_size": "16M",
    "read_chunk_size": "16M",
    "read_chunk_limit": "256M",
    "read_only": false,
    "icon": "assets/icons/googledrive.ico"
  },
  {
    "name": "home-nas",
    "remote": "home_nas:/mnt/storage",
    "drive_letter": "Z:",
    "volume_name": "Home Server NAS",
    "cache_dir": ".cache/home_nas",
    "cache_size": "25G",
    "buffer_size": "16M",
    "read_chunk_size": "16M",
    "read_chunk_limit": "256M",
    "read_only": false,
    "icon": "assets/icons/nextcloud.ico"
  }
]
